### ISSUE TITLE
TCP input connection counter broken

### ISSUE THREAD

**Issue by kroepke** [Graylog2/graylog2-server#888]
in1.0.0-beta.2:
after two connections it shows:
`Total connections: 2 (-1 active)`

**Comment by bernd** [comment]
I am unable to reproduce that on Linux with `echo foo | nc localhost 5555`. (1.0 branch, commit c7f9fd5)

**Comment by bernd** [comment]
There seems to be a problem with GNU netcat when using its `-c` option. If that option is used, netty does not see the `channelConnected` event.

**Comment by kroepke** [comment]
There is an extra TCP RESET packet in the stream, which doesn't not seem to be play nice with OS X's tcp stack/jvm/netty. Unsure which one is at fault (maybe it's us?)
This exhange works fine and calls both channelConnected/channelDisconnected:
```
echo -n foobar | ncat 127.0.0.1 5555

IP 127.0.0.1.63840 > 127.0.0.1.5555: Flags [S], seq 3732679391, win 65535, options [mss 16344,nop,wscale 5,nop,nop,TS val 1908815286 ecr 0,sackOK,eol], length 0
IP 127.0.0.1.5555 > 127.0.0.1.63840: Flags [S.], seq 2193220836, ack 3732679392, win 65535, options [mss 16344,nop,wscale 5,nop,nop,TS val 1908815286 ecr 1908815286,sackOK,eol], length 0
IP 127.0.0.1.63840 > 127.0.0.1.5555: Flags [.], ack 1, win 12759, options [nop,nop,TS val 1908815286 ecr 1908815286], length 0
IP 127.0.0.1.5555 > 127.0.0.1.63840: Flags [.], ack 1, win 33174, options [nop,nop,TS val 1908815286 ecr 1908815286], length 0
IP 127.0.0.1.63840 > 127.0.0.1.5555: Flags [P.], seq 1:7, ack 1, win 12759, options [nop,nop,TS val 1908815286 ecr 1908815286], length 6
IP 127.0.0.1.63840 > 127.0.0.1.5555: Flags [F.], seq 7, ack 1, win 12759, options [nop,nop,TS val 1908815286 ecr 1908815286], length 0
IP 127.0.0.1.5555 > 127.0.0.1.63840: Flags [.], ack 7, win 33174, options [nop,nop,TS val 1908815286 ecr 1908815286], length 0
IP 127.0.0.1.5555 > 127.0.0.1.63840: Flags [.], ack 8, win 33174, options [nop,nop,TS val 1908815286 ecr 1908815286], length 0
IP 127.0.0.1.63840 > 127.0.0.1.5555: Flags [F.], seq 7, ack 1, win 12759, options [nop,nop,TS val 1908815286 ecr 1908815286], length 0
IP 127.0.0.1.63840 > 127.0.0.1.5555: Flags [.], ack 1, win 12759, options [nop,nop,TS val 1908815286 ecr 1908815286], length 0
IP 127.0.0.1.5555 > 127.0.0.1.63840: Flags [.], ack 8, win 33174, options [nop,nop,TS val 1908815286 ecr 1908815286], length 0
IP 127.0.0.1.5555 > 127.0.0.1.63840: Flags [F.], seq 1, ack 8, win 33174, options [nop,nop,TS val 1908815287 ecr 1908815286], length 0
IP 127.0.0.1.63840 > 127.0.0.1.5555: Flags [.], ack 2, win 12759, options [nop,nop,TS val 1908815287 ecr 1908815287], length 0
```

This one doesn't, only calls channelDisconnected():
```
echo -n foobar | nc -c 127.0.0.1 5555

P 127.0.0.1.63861 > 127.0.0.1.5555: Flags [S], seq 2961565569, win 65535, options [mss 16344,nop,wscale 5,nop,nop,TS val 1908870437 ecr 0,sackOK,eol], length 0
IP 127.0.0.1.5555 > 127.0.0.1.63861: Flags [S.], seq 1461290618, ack 2961565570, win 65535, options [mss 16344,nop,wscale 5,nop,nop,TS val 1908870437 ecr 1908870437,sackOK,eol], length 0
IP 127.0.0.1.63861 > 127.0.0.1.5555: Flags [.], ack 1, win 12759, options [nop,nop,TS val 1908870437 ecr 1908870437], length 0
IP 127.0.0.1.63861 > 127.0.0.1.5555: Flags [P.], seq 1:7, ack 1, win 12759, options [nop,nop,TS val 1908870437 ecr 1908870437], length 6
IP 127.0.0.1.63861 > 127.0.0.1.5555: Flags [F.], seq 7, ack 1, win 12759, options [nop,nop,TS val 1908870437 ecr 1908870437], length 0
IP 127.0.0.1.63861 > 127.0.0.1.5555: Flags [R.], seq 8, ack 1, win 12759, length 0
IP 127.0.0.1.5555 > 127.0.0.1.63861: Flags [.], ack 1, win 33174, options [nop,nop,TS val 1908870437 ecr 1908870437], length 0
IP 127.0.0.1.5555 > 127.0.0.1.63861: Flags [.], ack 7, win 33174, options [nop,nop,TS val 1908870437 ecr 1908870437], length 0
IP 127.0.0.1.5555 > 127.0.0.1.63861: Flags [.], ack 8, win 33174, options [nop,nop,TS val 1908870437 ecr 1908870437], length 0
IP 127.0.0.1.63861 > 127.0.0.1.5555: Flags [R], seq 2961565570, win 0, length 0
IP 127.0.0.1.63861 > 127.0.0.1.5555: Flags [R], seq 2961565576, win 0, length 0
IP 127.0.0.1.63861 > 127.0.0.1.5555: Flags [R], seq 2961565577, win 0, length 0
```
