### ISSUE TITLE
After update to  6.1.4 not inputs

### ISSUE THREAD

**Issue by hsh-it** [Graylog2/graylog2-server#21153]
I updated the container version as usual and it worked. However, I no longer receive any inputs
![Image](https://github.com/user-attachments/assets/5a7d37fa-4a35-4e8f-8852-10f775e817f6)

I have not changed anything in any config and see the past inputs in the history but since yesterday there is nothing more.

What can I do now to solve the problem?

But tcpdump shows me that the requests are still arriving at the server
```
10:26:44.712054 IP Input-hosts.45981 > Graylogserver.5514: UDP, length 109
10:26:44.712201 IP Input-hosts.45981 > Graylogserver.5514: UDP, length 125
10:26:44.719902 IP Input-hosts.45981 > Graylogserver.5514: UDP, length 110
10:26:44.720061 IP Input-hosts.45981 > Graylogserver.5514: UDP, length 90
10:26:44.720212 IP Input-hosts.45981 > Graylogserver.5514: UDP, length 95
10:26:44.720449 IP Input-hosts.45981 > Graylogserver.5514: UDP, length 99
10:26:44.721008 IP Input-hosts.45981 > Graylogserver.5514: UDP, length 92
10:26:44.721187 IP Input-hosts.45981 > Graylogserver.5514: UDP, length 95
10:26:44.721841 IP Input-hosts.45981 > Graylogserver.5514: UDP, length 102
10:26:44.757344 IP Input-hosts.44693 > Graylogserver.5514: UDP, length 181
10:26:44.764201 IP Input-hosts.44693 > Graylogserver.5514: UDP, length 135
10:26:44.765607 IP Input-hosts.50404 > Graylogserver.5514: UDP, length 219
10:26:44.770424 IP Input-hosts.44693 > Graylogserver.5514: UDP, length 98
10:26:44.771417 IP Input-hosts.44693 > Graylogserver.5514: UDP, length 104
10:26:44.837263 IP Input-hosts.44693 > Graylogserver.5514: UDP, length 138
10:26:44.837264 IP Input-hosts.44693 > Graylogserver.5514: UDP, length 115
10:26:44.838504 IP Input-hosts.44693 > Graylogserver.5514: UDP, length 115
10:26:44.844661 IP Input-hosts.44693 > Graylogserver.5514: UDP, length 110
10:26:44.846603 IP Input-hosts.44693 > Graylogserver.5514: UDP, length 130
10:26:44.850750 IP Input-hosts.44693 > Graylogserver.5514: UDP, length 157
10:26:44.850751 IP Input-hosts.44693 > Graylogserver.5514: UDP, length 96
10:26:44.874891 IP Input-hosts.44693 > Graylogserver.5514: UDP, length 175
10:26:44.938167 IP Input-hosts.39716 > Graylogserver.5514: UDP, length 202
10:26:45.024092 IP Input-hosts.44693 > Graylogserver.5514: UDP, length 181
10:26:45.027710 IP Input-hosts.44693 > Graylogserver.5514: UDP, length 135
10:26:45.034550 IP Input-hosts.44693 > Graylogserver.5514: UDP, length 104
10:26:45.034722 IP Input-hosts.44693 > Graylogserver.5514: UDP, length 98
10:26:45.082408 IP Input-hosts.48993 > Graylogserver.5514: UDP, length 190
10:26:45.082408 IP Input-hosts.48993 > Graylogserver.5514: UDP, length 190
10:26:45.088268 IP Input-hosts.59922 > Graylogserver.5514: UDP, length 187
10:26:45.090548 IP Input-hosts.59922 > Graylogserver.5514: UDP, length 142
10:26:45.094594 IP Input-hosts.44693 > Graylogserver.5514: UDP, length 157
10:26:45.097708 IP Input-hosts.59922 > Graylogserver.5514: UDP, length 98
10:26:45.098951 IP Input-hosts.59922 > Graylogserver.5514: UDP, length 110
10:26:45.101411 IP Input-hosts.59922 > Graylogserver.5514: UDP, length 108
10:26:45.107234 IP Input-hosts.44693 > Graylogserver.5514: UDP, length 138
10:26:45.107234 IP Input-hosts.44693 > Graylogserver.5514: UDP, length 115
10:26:45.108189 IP Input-hosts.44693 > Graylogserver.5514: UDP, length 115
10:26:45.109564 IP Input-hosts.59922 > Graylogserver.5514: UDP, length 108
10:26:45.111159 IP Input-hosts.59922 > Graylogserver.5514: UDP, length 98
10:26:45.114566 IP Input-hosts.44693 > Graylogserver.5514: UDP, length 110
```
## Your Environment

```yml
services:
  mongodb:
    image: "mongo:5.0"
    volumes:
      - "mongodb_data:/data/db"
    restart: "on-failure"

  # For DataNode setup, graylog starts with a preflight UI, this is a change from just using OpenSearch/Elasticsearch.
  # Please take a look at the README at the top of this repo or the regular docs for more info.
  datanode:
    image: "${DATANODE_IMAGE:-graylog/graylog-datanode:6.1}"
    hostname: "opensearch"
    environment:
      GRAYLOG_DATANODE_NODE_ID_FILE: "/var/lib/graylog-datanode/node-id"
      GRAYLOG_DATANODE_PASSWORD_SECRET: "${GRAYLOG_PASSWORD_SECRET:?Please configure GRAYLOG_PASSWORD_SECRET in the .env file}"
      GRAYLOG_DATANODE_ROOT_PASSWORD_SHA2: "${GRAYLOG_ROOT_PASSWORD_SHA2:?Please configure GRAYLOG_ROOT_PASSWORD_SHA2 in the .env file}"
      GRAYLOG_DATANODE_MONGODB_URI: "mongodb://mongodb:27017/graylog"
    ulimits:
      memlock:
        hard: -1
        soft: -1
      nofile:
        soft: 65536
        hard: 65536
    ports:
      - "8999:8999/tcp"   # DataNode API
      - "9200:9200/tcp"
      - "9300:9300/tcp"
    volumes:
      - "graylog-datanode:/var/lib/graylog-datanode"
    restart: "on-failure"

  graylog:
    hostname: "server"
    image: "${GRAYLOG_IMAGE:-graylog/graylog:6.1}"
    depends_on:
      mongodb:
        condition: "service_started"
    entrypoint: "/usr/bin/tini --  /docker-entrypoint.sh"
    environment:
      GRAYLOG_NODE_ID_FILE: "/usr/share/graylog/data/data/node-id"
      GRAYLOG_PASSWORD_SECRET: "${GRAYLOG_PASSWORD_SECRET:?Please configure GRAYLOG_PASSWORD_SECRET in the .env file}"
      GRAYLOG_ROOT_PASSWORD_SHA2: "${GRAYLOG_ROOT_PASSWORD_SHA2:?Please configure GRAYLOG_ROOT_PASSWORD_SHA2 in the .env file}"
      GRAYLOG_HTTP_BIND_ADDRESS: "0.0.0.0:9000"
      GRAYLOG_HTTP_EXTERNAL_URI: "http://localhost:9000/"
      GRAYLOG_MONGODB_URI: "mongodb://mongodb:27017/graylog"
    ports:
    - "5044:5044/tcp"   # Beats
    - "5140:5140/udp"   # Syslog
    - "5140:5140/tcp"   # Syslog
    - "5555:5555/tcp"   # RAW TCP
    - "5555:5555/udp"   # RAW UDP
    - "9000:9000/tcp"   # Server API
    - "12201:12201/tcp" # GELF TCP
    - "12201:12201/udp" # GELF UDP
    #- "10000:10000/tcp" # Custom TCP port
    #- "10000:10000/udp" # Custom UDP port
    - "13301:13301/tcp" # Forwarder data
    - "13302:13302/tcp" # Forwarder config
    volumes:
      - "graylog_data:/usr/share/graylog/data/data"
      - "graylog_journal:/usr/share/graylog/data/journal"
    restart: "on-failure"

volumes:
  mongodb_data:
  graylog-datanode:
  graylog_data:
  graylog_journal:
```

**Comment by dennisoelkers** [comment]
Hey @hsh-it,

thanks for reporting this. What was the previous version you updated to `6.1.4` from? Do you see anything in your server logs?
